{
  "name": "Custom Level 5",
  "description": "Generated by Level Editor",
  "startPosition": {
    "x": 647.8013792120585,
    "y": 325.5535819958844
  },
  "targetPosition": {
    "x": 101,
    "y": 114
  },
  "objects": [
    {
      "type": "penguin",
      "className": "Penguin",
      "position": {
        "x": 647.8013792120585,
        "y": 325.5535819958844
      },
      "properties": {
        "renderOrder": 5,
        "state": "idle",
        "x": 647.8013792120585,
        "y": 325.5535819958844,
        "vx": 0,
        "vy": 0,
        "radius": 16,
        "mass": 1,
        "launched": false,
        "maxTrailLength": 20,
        "currentAnimationType": "xc",
        "isSpinning": false,
        "initialized": true,
        "aniFrame": 0,
        "aniDir": 1,
        "aniMax": 11,
        "aniMin": 0,
        "aniSwap": 1,
        "crashedTimer": 0,
        "crashedDuration": 2,
        "crashedFrameCount": 0,
        "realSpritesLoaded": true
      }
    },
    {
      "type": "slingshot",
      "className": "Slingshot",
      "position": {
        "x": 618,
        "y": 329
      },
      "properties": {
        "rotation": -6.596738297894214,
        "alpha": 1,
        "visible": true,
        "width": 100,
        "height": 100,
        "renderOrder": 3,
        "velocityMultiplier": 15,
        "maxPullback": 100,
        "minPullback": 10,
        "isPulling": false,
        "rubberBandColor": "#FFFF00",
        "hoopColor": "#00FFFF",
        "glowColor": "#0099FF",
        "hoopRadiusX": 16,
        "hoopRadiusY": 29
      }
    },
    {
      "type": "target",
      "className": "Target",
      "position": {
        "x": 101,
        "y": 114
      },
      "properties": {
        "rotation": 0,
        "alpha": 1,
        "visible": true,
        "width": 50,
        "height": 80,
        "renderOrder": 4,
        "spriteType": "ship_open",
        "shipState": "open",
        "hitFrameCount": 0,
        "hitDuration": 30,
        "isHit": false
      }
    },
    {
      "type": "planet",
      "className": "Planet",
      "position": {
        "x": 499,
        "y": 158
      },
      "properties": {
        "rotation": 0,
        "alpha": 1,
        "visible": true,
        "width": 50,
        "height": 50,
        "renderOrder": 2,
        "radius": 25,
        "mass": 200,
        "collisionRadius": 33,
        "gravitationalReach": 5000,
        "color": "#FF0000",
        "planetType": "planet_grey",
        "orbit": {
          "orbitCenter": {
            "x": 0,
            "y": 0
          },
          "orbitRadius": 0,
          "orbitSpeed": 0,
          "orbitAngle": 0,
          "orbitType": "circular",
          "orbitParams": {}
        }
      }
    },
    {
      "type": "bonus",
      "className": "Bonus",
      "position": {
        "x": 718,
        "y": 226
      },
      "properties": {
        "rotation": -30446.978817680218,
        "alpha": 0.9637326971100139,
        "visible": true,
        "width": 42.5,
        "height": 43,
        "renderOrder": 1,
        "value": 3000,
        "rotationSpeed": 3,
        "state": "notHit",
        "collectedRotationSpeed": 30,
        "collected": false,
        "pulseTimer": -10169.16939933319,
        "pulseSpeed": 0.1,
        "orbit": {
          "orbitCenter": {
            "x": 0,
            "y": 0
          },
          "orbitRadius": 0,
          "orbitSpeed": 0,
          "orbitAngle": 0,
          "orbitType": "circular",
          "orbitParams": {}
        }
      }
    },
    {
      "type": "bonus",
      "className": "Bonus",
      "position": {
        "x": 726,
        "y": 463
      },
      "properties": {
        "rotation": -30507.508198000214,
        "alpha": 0.9637326971100139,
        "visible": true,
        "width": 42.5,
        "height": 43,
        "renderOrder": 1,
        "value": 3000,
        "rotationSpeed": 3,
        "state": "notHit",
        "collectedRotationSpeed": 30,
        "collected": false,
        "pulseTimer": -10169.16939933319,
        "pulseSpeed": 0.1,
        "orbit": {
          "orbitCenter": {
            "x": 0,
            "y": 0
          },
          "orbitRadius": 0,
          "orbitSpeed": 0,
          "orbitAngle": 0,
          "orbitType": "circular",
          "orbitParams": {}
        }
      }
    },
    {
      "type": "bonus",
      "className": "Bonus",
      "position": {
        "x": 62,
        "y": 201
      },
      "properties": {
        "rotation": -30507.508198000214,
        "alpha": 0.9637326971100139,
        "visible": true,
        "width": 42.5,
        "height": 43,
        "renderOrder": 1,
        "value": 3000,
        "rotationSpeed": 3,
        "state": "notHit",
        "collectedRotationSpeed": 30,
        "collected": false,
        "pulseTimer": -10169.16939933319,
        "pulseSpeed": 0.1,
        "orbit": {
          "orbitCenter": {
            "x": 0,
            "y": 0
          },
          "orbitRadius": 0,
          "orbitSpeed": 0,
          "orbitAngle": 0,
          "orbitType": "circular",
          "orbitParams": {}
        }
      }
    },
    {
      "type": "bonus",
      "className": "Bonus",
      "position": {
        "x": 60,
        "y": 363
      },
      "properties": {
        "rotation": -30483.13999418688,
        "alpha": 0.9637326971100139,
        "visible": true,
        "width": 42.5,
        "height": 43,
        "renderOrder": 1,
        "value": 3000,
        "rotationSpeed": 3,
        "state": "notHit",
        "collectedRotationSpeed": 30,
        "collected": false,
        "pulseTimer": -10169.16939933319,
        "pulseSpeed": 0.1,
        "orbit": {
          "orbitCenter": {
            "x": 0,
            "y": 0
          },
          "orbitRadius": 0,
          "orbitSpeed": 0,
          "orbitAngle": 0,
          "orbitType": "circular",
          "orbitParams": {}
        }
      }
    },
    {
      "type": "planet",
      "className": "Planet",
      "position": {
        "x": 424,
        "y": 491
      },
      "properties": {
        "rotation": 0,
        "alpha": 1,
        "visible": true,
        "width": 50,
        "height": 50,
        "renderOrder": 2,
        "radius": 25,
        "mass": 200,
        "collisionRadius": 33,
        "gravitationalReach": 0,
        "color": "#FF0000",
        "planetType": "planet_grey",
        "orbit": {
          "orbitCenter": {
            "x": 0,
            "y": 0
          },
          "orbitRadius": 0,
          "orbitSpeed": 0,
          "orbitAngle": 0,
          "orbitType": "circular",
          "orbitParams": {}
        }
      }
    },
    {
      "type": "textobject",
      "className": "TextObject",
      "position": {
        "x": 259,
        "y": 551
      },
      "properties": {
        "rotation": 0,
        "alpha": 1,
        "visible": true,
        "width": 193.4609375,
        "height": 77.6,
        "renderOrder": 8,
        "content": "Can you get all 4 distance bonuses on the way to the ship?",
        "fontSize": 16,
        "color": "#FFFFFF",
        "fontFamily": "Arial, sans-serif",
        "textAlign": "left",
        "backgroundColor": "rgba(0, 0, 0, 0.7)",
        "padding": 10,
        "autoSize": true,
        "borderRadius": 8,
        "maxWidth": 180,
        "fadeIn": false,
        "fadeInDuration": 1,
        "fadeTimer": 0
      }
    }
  ],
  "rules": {
    "maxTries": null,
    "timeLimit": null,
    "scoreMultiplier": 1,
    "requiredBonuses": null,
    "allowedMisses": null,
    "gravitationalConstant": 2
  }
}