{
  "name": "Custom Level 11",
  "description": "Generated by Level Editor",
  "startPosition": {
    "x": 107,
    "y": 157
  },
  "targetPosition": {
    "x": 700,
    "y": 300
  },
  "objects": [
    {
      "type": "slingshot",
      "className": "Slingshot",
      "position": {
        "x": 107,
        "y": 157
      },
      "properties": {
        "name": "Slingshot 1",
        "rotation": 135,
        "alpha": 1,
        "visible": true,
        "width": 100,
        "height": 100,
        "renderOrder": 3,
        "velocityMultiplier": 8,
        "maxPullback": 100,
        "minPullback": 10,
        "isPulling": false,
        "rubberBandColor": "#FFFF00",
        "hoopColor": "#00FFFF",
        "glowColor": "#0099FF",
        "hoopRadiusX": 16,
        "hoopRadiusY": 29
      }
    },
    {
      "type": "target",
      "className": "Target",
      "position": {
        "x": 700,
        "y": 300
      },
      "properties": {
        "name": "Target 1",
        "rotation": 0,
        "alpha": 1,
        "visible": true,
        "width": 60,
        "height": 60,
        "renderOrder": 4,
        "spriteType": "ship_open",
        "shipState": "open",
        "hitFrameCount": 0,
        "hitDuration": 30,
        "isHit": false
      }
    },
    {
      "type": "planet",
      "className": "Planet",
      "position": {
        "x": 242.58100147560447,
        "y": 344.78690163432117
      },
      "properties": {
        "id": "planet_3",
        "name": "orbiting big one",
        "rotation": 0,
        "alpha": 1,
        "visible": true,
        "width": 80.4694410776266,
        "height": 80.4694410776266,
        "renderOrder": 2,
        "radius": 40.2347205388133,
        "mass": 100,
        "collisionRadius": 48.2347205388133,
        "gravitationalReach": 5000,
        "color": "#FF00FF",
        "planetType": "planet_red_gumball",
        "orbit": {
          "orbitCenter": null,
          "orbitTargetId": "planet_4",
          "orbitRadius": 141,
          "orbitSpeed": 1,
          "orbitAngle": 317.2100459999817,
          "orbitType": "circular",
          "orbitParams": {}
        }
      }
    },
    {
      "type": "planet",
      "className": "Planet",
      "position": {
        "x": 383,
        "y": 332
      },
      "properties": {
        "id": "planet_4",
        "name": "big planent",
        "rotation": 0,
        "alpha": 1,
        "visible": true,
        "width": 160,
        "height": 160,
        "renderOrder": 2,
        "radius": 80,
        "mass": 350,
        "collisionRadius": 88,
        "gravitationalReach": 0,
        "color": "#FF0000",
        "planetType": "planet_pink",
        "orbit": {
          "orbitCenter": null,
          "orbitTargetId": null,
          "orbitRadius": 0,
          "orbitSpeed": 0,
          "orbitAngle": 0,
          "orbitType": "circular",
          "orbitParams": {}
        }
      }
    },
    {
      "type": "planet",
      "className": "Planet",
      "position": {
        "x": 107.38541921276396,
        "y": 350.7936034003082
      },
      "properties": {
        "id": "planet_5",
        "name": "Planet 3 little one",
        "rotation": 0,
        "alpha": 1,
        "visible": true,
        "width": 60,
        "height": 60,
        "renderOrder": 2,
        "radius": 30,
        "mass": 70,
        "collisionRadius": 38,
        "gravitationalReach": 0,
        "color": "#0000FF",
        "planetType": "planet_sun",
        "orbit": {
          "orbitCenter": null,
          "orbitTargetId": null,
          "orbitRadius": 0,
          "orbitSpeed": 0,
          "orbitAngle": 0,
          "orbitType": "circular",
          "orbitParams": {}
        }
      }
    },
    {
      "type": "bonus",
      "className": "Bonus",
      "position": {
        "x": 244,
        "y": 446
      },
      "properties": {
        "id": "bonus_3",
        "name": "Bonus 1",
        "rotation": 407.59858535332984,
        "alpha": 0.9867865057561943,
        "visible": true,
        "width": 42.5,
        "height": 43,
        "renderOrder": 1,
        "value": 3000,
        "rotationSpeed": 3,
        "state": "notHit",
        "collectedRotationSpeed": 30,
        "collected": false,
        "pulseTimer": 82.19516999999904,
        "pulseSpeed": 0.1,
        "orbit": {
          "orbitCenter": null,
          "orbitTargetId": null,
          "orbitRadius": 0,
          "orbitSpeed": 0,
          "orbitAngle": 0,
          "orbitType": "circular",
          "orbitParams": {}
        }
      }
    }
  ],
  "rules": {
    "maxTries": null,
    "timeLimit": null,
    "scoreMultiplier": 1.9,
    "requiredBonuses": null,
    "allowedMisses": null,
    "gravitationalConstant": 3
  }
}
