{
  "name": "Custom Level 9",
  "description": "Generated by Level Editor",
  "startPosition": {
    "x": 77,
    "y": 301
  },
  "targetPosition": {
    "x": 654,
    "y": 216
  },
  "objects": [
    {
      "type": "slingshot",
      "className": "Slingshot",
      "position": {
        "x": 77,
        "y": 301
      },
      "properties": {
        "name": "Slingshot 1",
        "rotation": 91.39718102729637,
        "alpha": 1,
        "visible": true,
        "width": 100,
        "height": 100,
        "renderOrder": 3,
        "velocityMultiplier": 8,
        "maxPullback": 100,
        "minPullback": 10,
        "isPulling": false,
        "rubberBandColor": "#FFFF00",
        "hoopColor": "#00FFFF",
        "glowColor": "#0099FF",
        "hoopRadiusX": 16,
        "hoopRadiusY": 29
      }
    },
    {
      "type": "target",
      "className": "Target",
      "position": {
        "x": 654,
        "y": 216
      },
      "properties": {
        "name": "Target 1",
        "rotation": 0,
        "alpha": 1,
        "visible": true,
        "width": 80,
        "height": 60,
        "renderOrder": 4,
        "spriteType": "ship_open",
        "shipState": "closed",
        "hitFrameCount": 0,
        "hitDuration": 30,
        "isHit": false
      }
    },
    {
      "type": "planet",
      "className": "Planet",
      "position": {
        "x": 369.31760432541364,
        "y": 323.1966009189499
      },
      "properties": {
        "name": "Big Sun",
        "rotation": 0,
        "alpha": 1,
        "visible": true,
        "width": 64.26589027410711,
        "height": 64.26589027410711,
        "renderOrder": 2,
        "radius": 243,
        "mass": 500,
        "collisionRadius": 243,
        "gravitationalReach": 5000,
        "color": "#FF00FF",
        "planetType": "planet_saturn",
        "orbit": {
          "orbitCenter": null,
          "orbitRadius": 0,
          "orbitSpeed": 0,
          "orbitAngle": 0,
          "orbitType": "circular",
          "orbitParams": {}
        }
      }
    }
  ],
  "rules": {
    "maxTries": null,
    "timeLimit": null,
    "scoreMultiplier": 1.8,
    "requiredBonuses": null,
    "allowedMisses": null,
    "gravitationalConstant": 3
  }
}