{
  "name": "Custom Level 2",
  "description": "Generated by Level Editor",
  "startPosition": {
    "x": 679,
    "y": 480
  },
  "targetPosition": {
    "x": 74,
    "y": 146
  },
  "objects": [
    {
      "type": "penguin",
      "className": "Penguin",
      "position": {
        "x": 679,
        "y": 480
      },
      "properties": {
        "renderOrder": 5,
        "state": "idle",
        "x": 679,
        "y": 480,
        "vx": 0,
        "vy": 0,
        "radius": 16,
        "mass": 1,
        "launched": false,
        "maxTrailLength": 20,
        "currentAnimationType": "xc",
        "isSpinning": false,
        "initialized": true,
        "aniFrame": 0,
        "aniDir": 1,
        "aniMax": 11,
        "aniMin": 0,
        "aniSwap": 1,
        "crashedTimer": 0,
        "crashedDuration": 2,
        "crashedFrameCount": 0,
        "realSpritesLoaded": true
      }
    },
    {
      "type": "slingshot",
      "className": "Slingshot",
      "position": {
        "x": 665,
        "y": 478
      },
      "properties": {
        "rotation": 0,
        "alpha": 1,
        "visible": true,
        "width": 100,
        "height": 100,
        "renderOrder": 3,
        "velocityMultiplier": 10,
        "maxPullback": 100,
        "minPullback": 10,
        "isPulling": false,
        "rubberBandColor": "#FFFF00",
        "hoopColor": "#00FFFF",
        "glowColor": "#0099FF",
        "hoopRadiusX": 16,
        "hoopRadiusY": 29
      }
    },
    {
      "type": "target",
      "className": "Target",
      "position": {
        "x": 74,
        "y": 146
      },
      "properties": {
        "rotation": 0,
        "alpha": 1,
        "visible": true,
        "width": 60,
        "height": 60,
        "renderOrder": 4,
        "spriteType": "ship_open",
        "shipState": "open",
        "hitFrameCount": 0,
        "hitDuration": 30,
        "isHit": false
      }
    },
    {
      "type": "textobject",
      "className": "TextObject",
      "position": {
        "x": 446,
        "y": 208
      },
      "properties": {
        "rotation": 0,
        "alpha": 1,
        "visible": true,
        "width": 260.1171875,
        "height": 58.4,
        "renderOrder": 8,
        "content": "Distance bonus: adds to your distance which boosts your score!",
        "fontSize": 16,
        "color": "#FFFFCC",
        "fontFamily": "Arial, sans-serif",
        "textAlign": "left",
        "backgroundColor": "rgba(0, 0, 0, 0.7)",
        "padding": 10,
        "autoSize": true,
        "borderRadius": 8,
        "maxWidth": 260,
        "fadeIn": true,
        "fadeInDuration": 2,
        "fadeTimer": 2.006733333333335
      }
    },
    {
      "type": "pointingarrow",
      "className": "PointingArrow",
      "position": {
        "x": 367,
        "y": 267
      },
      "properties": {
        "rotation": 128.91147184580484,
        "alpha": 0.9992254894636597,
        "visible": true,
        "width": 31.000156249237065,
        "height": 20,
        "renderOrder": 9,
        "color": "#00FFFF",
        "glowColor": "#0099FF",
        "baseWidth": 30,
        "scaleWithDistance": true,
        "minWidth": 15,
        "maxWidth": 60,
        "pulseSpeed": 3,
        "pointingAt": {
          "x": 300,
          "y": 350
        },
        "maxDistance": 300,
        "pulseTimer": 23.53259999999979,
        "minAlpha": 0.6,
        "maxAlpha": 1
      }
    },
    {
      "type": "bonus",
      "className": "Bonus",
      "position": {
        "x": 349,
        "y": 294
      },
      "properties": {
        "rotation": 360.8884999999896,
        "alpha": 0.697730175877366,
        "visible": true,
        "width": 42.5,
        "height": 43,
        "renderOrder": 1,
        "value": 3000,
        "rotationSpeed": 3,
        "state": "notHit",
        "collectedRotationSpeed": 30,
        "collected": false,
        "pulseTimer": 120.29616666665582,
        "pulseSpeed": 0.1,
        "orbit": {
          "orbitCenter": null,
          "orbitRadius": 0,
          "orbitSpeed": 0,
          "orbitAngle": 0,
          "orbitType": "circular",
          "orbitParams": {}
        }
      }
    }
  ],
  "rules": {
    "maxTries": null,
    "timeLimit": null,
    "scoreMultiplier": 1.2,
    "requiredBonuses": null,
    "allowedMisses": null,
    "gravitationalConstant": 3
  }
}