{
  "name": "Custom Level 17",
  "description": "Generated by Level Editor",
  "startPosition": {
    "x": 658,
    "y": 295
  },
  "targetPosition": {
    "x": 83,
    "y": 278
  },
  "objects": [
    {
      "type": "slingshot",
      "className": "Slingshot",
      "position": {
        "x": 658,
        "y": 295
      },
      "properties": {
        "name": "Slingshot 1",
        "rotation": 0,
        "alpha": 1,
        "visible": true,
        "width": 100,
        "height": 100,
        "renderOrder": 3,
        "velocityMultiplier": 8,
        "maxPullback": 100,
        "minPullback": 10,
        "isPulling": false,
        "rubberBandColor": "#FFFF00",
        "hoopColor": "#00FFFF",
        "glowColor": "#0099FF",
        "hoopRadiusX": 16,
        "hoopRadiusY": 29
      }
    },
    {
      "type": "target",
      "className": "Target",
      "position": {
        "x": 83,
        "y": 278
      },
      "properties": {
        "name": "Target 1",
        "rotation": 0,
        "alpha": 1,
        "visible": true,
        "width": 60,
        "height": 60,
        "renderOrder": 4,
        "spriteType": "ship_open",
        "shipState": "open",
        "hitFrameCount": 0,
        "hitDuration": 30,
        "isHit": false
      }
    },
    {
      "type": "planet",
      "className": "Planet",
      "position": {
        "x": 385,
        "y": 100
      },
      "properties": {
        "id": "planet_1",
        "name": "Planet 1",
        "rotation": 0,
        "alpha": 1,
        "visible": true,
        "width": 59.461107003572906,
        "height": 59.461107003572906,
        "renderOrder": 2,
        "radius": 29.730553501786453,
        "mass": 110.58774131874546,
        "collisionRadius": 37.73055350178645,
        "gravitationalReach": 5000,
        "color": "#FF00FF",
        "planetType": "planet_grey",
        "orbit": {
          "orbitCenter": {
            "x": 385,
            "y": 300
          },
          "orbitTargetId": null,
          "orbitRadius": 150,
          "orbitSpeed": 3,
          "orbitAngle": 339.95319999999293,
          "orbitType": "gravity",
          "orbitParams": {
            "gravityStrength": 500,
            "initialVelocity": {
              "x": 0,
              "y": 5
            }
          }
        }
      }
    },
    {
      "type": "planet",
      "className": "Planet",
      "position": {
        "x": 285,
        "y": 100
      },
      "properties": {
        "id": "planet_2",
        "name": "Planet 2",
        "rotation": 0,
        "alpha": 1,
        "visible": true,
        "width": 59.461107003572906,
        "height": 59.461107003572906,
        "renderOrder": 2,
        "radius": 29.730553501786453,
        "mass": 110.58774131874546,
        "collisionRadius": 37.73055350178645,
        "gravitationalReach": 5000,
        "color": "#FF00FF",
        "planetType": "planet_grey",
        "orbit": {
          "orbitCenter": {
            "x": 285,
            "y": 290
          },
          "orbitTargetId": null,
          "orbitRadius": 150,
          "orbitSpeed": 3,
          "orbitAngle": 339.95319999999293,
          "orbitType": "gravity",
          "orbitParams": {
            "gravityStrength": 500,
            "initialVelocity": {
              "x": 0,
              "y": 5
            }
          }
        }
      }
    },
    {
      "type": "planet",
      "className": "Planet",
      "position": {
        "x": 185,
        "y": 100
      },
      "properties": {
        "id": "planet_3",
        "name": "Planet 3",
        "rotation": 0,
        "alpha": 1,
        "visible": true,
        "width": 59.461107003572906,
        "height": 59.461107003572906,
        "renderOrder": 2,
        "radius": 29.730553501786453,
        "mass": 110.58774131874546,
        "collisionRadius": 37.73055350178645,
        "gravitationalReach": 5000,
        "color": "#FF00FF",
        "planetType": "planet_grey",
        "orbit": {
          "orbitCenter": {
            "x": 185,
            "y": 280
          },
          "orbitTargetId": null,
          "orbitRadius": 150,
          "orbitSpeed": 3,
          "orbitAngle": 339.95319999999293,
          "orbitType": "gravity",
          "orbitParams": {
            "gravityStrength": 500,
            "initialVelocity": {
              "x": 0,
              "y": 5
            }
          }
        }
      }
    },
    {
      "type": "planet",
      "className": "Planet",
      "position": {
        "x": 485,
        "y": 100
      },
      "properties": {
        "id": "planet_4",
        "name": "Planet 4",
        "rotation": 0,
        "alpha": 1,
        "visible": true,
        "width": 59.461107003572906,
        "height": 59.461107003572906,
        "renderOrder": 2,
        "radius": 29.730553501786453,
        "mass": 110.58774131874546,
        "collisionRadius": 37.73055350178645,
        "gravitationalReach": 5000,
        "color": "#FF00FF",
        "planetType": "planet_grey",
        "orbit": {
          "orbitCenter": {
            "x": 485,
            "y": 310
          },
          "orbitTargetId": null,
          "orbitRadius": 150,
          "orbitSpeed": 3,
          "orbitAngle": 339.95319999999293,
          "orbitType": "gravity",
          "orbitParams": {
            "gravityStrength": 500,
            "initialVelocity": {
              "x": 0,
              "y": 5
            }
          }
        }
      }
    },
    {
      "type": "bonus",
      "className": "Bonus",
      "position": {
        "x": 445.01256410323657,
        "y": 458.2903934924746
      },
      "properties": {
        "id": "bonus_1",
        "name": "Bonus 1",
        "rotation": 186.67649999999426,
        "alpha": 0.7878803683389662,
        "visible": true,
        "width": 42.5,
        "height": 43,
        "renderOrder": 1,
        "value": 3000,
        "rotationSpeed": 3,
        "state": "notHit",
        "collectedRotationSpeed": 30,
        "collected": false,
        "pulseTimer": 62.22550000000111,
        "pulseSpeed": 0.1,
        "orbit": {
          "orbitCenter": {
            "x": 501,
            "y": 294
          },
          "orbitTargetId": null,
          "orbitRadius": 150,
          "orbitSpeed": 3,
          "orbitAngle": 12.39989999999999,
          "orbitType": "gravity",
          "orbitParams": {
            "gravityStrength": 1000,
            "initialVelocity": {
              "x": -126.76390752102044,
              "y": -51.79789027291108
            },
            "initialPosition": {
              "x": 651,
              "y": 294
            }
          }
        }
      }
    }
  ],
  "rules": {
    "maxTries": null,
    "timeLimit": null,
    "scoreMultiplier": 2.6,
    "requiredBonuses": null,
    "allowedMisses": null,
    "gravitationalConstant": 3
  }
}