{
  "name": "Custom Level 8",
  "description": "Generated by Level Editor",
  "startPosition": {
    "x": 657,
    "y": 335
  },
  "targetPosition": {
    "x": 86,
    "y": 102
  },
  "objects": [
    {
      "type": "slingshot",
      "className": "Slingshot",
      "position": {
        "x": 657,
        "y": 335
      },
      "properties": {
        "name": "Slingshot 1",
        "rotation": 135,
        "alpha": 1,
        "visible": true,
        "width": 100,
        "height": 100,
        "renderOrder": 3,
        "velocityMultiplier": 10,
        "maxPullback": 100,
        "minPullback": 10,
        "isPulling": false,
        "rubberBandColor": "#FFFF00",
        "hoopColor": "#00FFFF",
        "glowColor": "#0099FF",
        "hoopRadiusX": 16,
        "hoopRadiusY": 29
      }
    },
    {
      "type": "target",
      "className": "Target",
      "position": {
        "x": 86,
        "y": 102
      },
      "properties": {
        "name": "Target 1",
        "rotation": 0,
        "alpha": 1,
        "visible": true,
        "width": 60,
        "height": 60,
        "renderOrder": 4,
        "spriteType": "ship_open",
        "shipState": "closed",
        "hitFrameCount": 0,
        "hitDuration": 30,
        "isHit": false
      }
    },
    {
      "type": "planet",
      "className": "Planet",
      "position": {
        "x": 258,
        "y": 168
      },
      "properties": {
        "name": "Planet 1",
        "rotation": 0,
        "alpha": 1,
        "visible": true,
        "width": 120,
        "height": 120,
        "renderOrder": 2,
        "radius": 60,
        "mass": 250,
        "collisionRadius": 68,
        "gravitationalReach": 0,
        "color": "#FF0000",
        "planetType": "planet_saturn",
        "orbit": {
          "orbitCenter": null,
          "orbitRadius": 0,
          "orbitSpeed": 0,
          "orbitAngle": 0,
          "orbitType": "circular",
          "orbitParams": {}
        }
      }
    },
    {
      "type": "bonus",
      "className": "Bonus",
      "position": {
        "x": 176,
        "y": 137
      },
      "properties": {
        "name": "Bonus 1",
        "rotation": 174.40275530000028,
        "alpha": 0.6784823183555462,
        "visible": true,
        "width": 42.5,
        "height": 43,
        "renderOrder": 1,
        "value": 100,
        "rotationSpeed": 3,
        "state": "Hit",
        "collectedRotationSpeed": 30,
        "collected": false,
        "pulseTimer": 37.946134000000676,
        "pulseSpeed": 0.1,
        "orbit": {
          "orbitCenter": null,
          "orbitRadius": 0,
          "orbitSpeed": 0,
          "orbitAngle": 0,
          "orbitType": "circular",
          "orbitParams": {}
        }
      }
    },
    {
      "type": "planet",
      "className": "Planet",
      "position": {
        "x": 519,
        "y": 145
      },
      "properties": {
        "name": "Planet 2",
        "rotation": 0,
        "alpha": 1,
        "visible": true,
        "width": 60,
        "height": 60,
        "renderOrder": 2,
        "radius": 30,
        "mass": 200,
        "collisionRadius": 38,
        "gravitationalReach": 0,
        "color": "#FF00FF",
        "planetType": "planet_grey",
        "orbit": {
          "orbitCenter": null,
          "orbitRadius": 0,
          "orbitSpeed": 0,
          "orbitAngle": 0,
          "orbitType": "circular",
          "orbitParams": {}
        }
      }
    },
    {
      "type": "planet",
      "className": "Planet",
      "position": {
        "x": 459,
        "y": 499
      },
      "properties": {
        "name": "Planet 3",
        "rotation": 0,
        "alpha": 1,
        "visible": true,
        "width": 60,
        "height": 60,
        "renderOrder": 2,
        "radius": 30,
        "mass": 200,
        "collisionRadius": 38,
        "gravitationalReach": 0,
        "color": "#FF00FF",
        "planetType": "planet_grey",
        "orbit": {
          "orbitCenter": null,
          "orbitRadius": 0,
          "orbitSpeed": 0,
          "orbitAngle": 0,
          "orbitType": "circular",
          "orbitParams": {}
        }
      }
    },
    {
      "type": "bonus",
      "className": "Bonus",
      "position": {
        "x": 687,
        "y": 138
      },
      "properties": {
        "name": "Bonus 2",
        "rotation": 174.4026755200005,
        "alpha": 0.6784823183555462,
        "visible": true,
        "width": 42.5,
        "height": 43,
        "renderOrder": 1,
        "value": 100,
        "rotationSpeed": 3,
        "state": "Hit",
        "collectedRotationSpeed": 30,
        "collected": false,
        "pulseTimer": 37.946134000000676,
        "pulseSpeed": 0.1,
        "orbit": {
          "orbitCenter": null,
          "orbitRadius": 0,
          "orbitSpeed": 0,
          "orbitAngle": 0,
          "orbitType": "circular",
          "orbitParams": {}
        }
      }
    },
    {
      "type": "bonus",
      "className": "Bonus",
      "position": {
        "x": 700,
        "y": 516
      },
      "properties": {
        "name": "Bonus 3",
        "rotation": 174.40518523333364,
        "alpha": 0.6784823183555462,
        "visible": true,
        "width": 42.5,
        "height": 43,
        "renderOrder": 1,
        "value": 100,
        "rotationSpeed": 3,
        "state": "Hit",
        "collectedRotationSpeed": 30,
        "collected": false,
        "pulseTimer": 37.946134000000676,
        "pulseSpeed": 0.1,
        "orbit": {
          "orbitCenter": null,
          "orbitRadius": 0,
          "orbitSpeed": 0,
          "orbitAngle": 0,
          "orbitType": "circular",
          "orbitParams": {}
        }
      }
    }
  ],
  "rules": {
    "maxTries": null,
    "timeLimit": null,
    "scoreMultiplier": 1.7000000000000002,
    "requiredBonuses": null,
    "allowedMisses": null,
    "gravitationalConstant": 3
  }
}