{
  "name": "Custom Level 18",
  "description": "Generated by Level Editor",
  "startPosition": {
    "x": 131,
    "y": 453
  },
  "targetPosition": {
    "x": 536.5340564091233,
    "y": 55.182510543564746
  },
  "objects": [
    {
      "type": "slingshot",
      "className": "Slingshot",
      "position": {
        "x": 131,
        "y": 453
      },
      "properties": {
        "name": "Slingshot 1",
        "rotation": 204.0040076481176,
        "alpha": 1,
        "visible": true,
        "width": 100,
        "height": 100,
        "renderOrder": 3,
        "velocityMultiplier": 8,
        "maxPullback": 100,
        "minPullback": 10,
        "isPulling": false,
        "rubberBandColor": "#FFFF00",
        "hoopColor": "#00FFFF",
        "glowColor": "#0099FF",
        "hoopRadiusX": 16,
        "hoopRadiusY": 29
      }
    },
    {
      "type": "target",
      "className": "Target",
      "position": {
        "x": 536.5340564091233,
        "y": 55.182510543564746
      },
      "properties": {
        "name": "Target 1",
        "rotation": 0,
        "alpha": 1,
        "visible": true,
        "width": 60,
        "height": 60,
        "renderOrder": 4,
        "spriteType": "ship_open",
        "shipState": "open",
        "hitFrameCount": 0,
        "hitDuration": 30,
        "isHit": false,
        "orbit": {
          "orbitCenter": {
            "x": 548.0911120367524,
            "y": 160.5506008993261
          },
          "orbitTargetId": null,
          "orbitRadius": 106,
          "orbitSpeed": -1,
          "orbitAngle": 80.00136666666972,
          "orbitType": "circular",
          "orbitParams": {}
        }
      }
    },
    {
      "type": "planet",
      "className": "Planet",
      "position": {
        "x": 547.9446231843394,
        "y": 159.01328245941204
      },
      "properties": {
        "id": "planet_5",
        "name": "Planet 5",
        "rotation": 0,
        "alpha": 1,
        "visible": true,
        "width": 48.258111856693986,
        "height": 48.258111856693986,
        "renderOrder": 2,
        "radius": 62.129055928347,
        "mass": 302.140231211069,
        "collisionRadius": 62.129055928347,
        "gravitationalReach": 5000,
        "color": "#FF00FF",
        "planetType": "planet_sun",
        "orbit": {
          "orbitCenter": null,
          "orbitTargetId": null,
          "orbitRadius": 0,
          "orbitSpeed": 0,
          "orbitAngle": 0,
          "orbitType": "circular",
          "orbitParams": {}
        }
      }
    },
    {
      "type": "planet",
      "className": "Planet",
      "position": {
        "x": 326.94462318433943,
        "y": 366.01328245941204
      },
      "properties": {
        "id": "planet_2",
        "name": "Planet 5",
        "rotation": 0,
        "alpha": 1,
        "visible": true,
        "width": 48.258111856693986,
        "height": 48.258111856693986,
        "renderOrder": 2,
        "radius": 62.129055928347,
        "mass": 302.140231211069,
        "collisionRadius": 62.129055928347,
        "gravitationalReach": 5000,
        "color": "#FF00FF",
        "planetType": "planet_red_gumball",
        "orbit": {
          "orbitCenter": null,
          "orbitTargetId": null,
          "orbitRadius": 0,
          "orbitSpeed": 0,
          "orbitAngle": 0,
          "orbitType": "circular",
          "orbitParams": {}
        }
      }
    },
    {
      "type": "bonus",
      "className": "Bonus",
      "position": {
        "x": 584,
        "y": 472
      },
      "properties": {
        "id": "bonus_1",
        "name": "Bonus 1",
        "rotation": 38.078400000000265,
        "alpha": 0.9909774571624972,
        "visible": true,
        "width": 42.5,
        "height": 43,
        "renderOrder": 1,
        "value": 3000,
        "rotationSpeed": 3,
        "state": "notHit",
        "collectedRotationSpeed": 30,
        "collected": false,
        "pulseTimer": 12.69279999999999,
        "pulseSpeed": 0.1,
        "orbit": {
          "orbitCenter": null,
          "orbitTargetId": null,
          "orbitRadius": 0,
          "orbitSpeed": 0,
          "orbitAngle": 0,
          "orbitType": "circular",
          "orbitParams": {}
        }
      }
    }
  ],
  "rules": {
    "maxTries": null,
    "timeLimit": null,
    "scoreMultiplier": 2.7,
    "requiredBonuses": null,
    "allowedMisses": null,
    "gravitationalConstant": 3
  }
}