{
  "name": "Custom Level 1",
  "description": "Generated by Level Editor",
  "startPosition": {
    "x": 638.1312702970075,
    "y": 479.97866287070036
  },
  "targetPosition": {
    "x": 73,
    "y": 97
  },
  "objects": [
    {
      "type": "penguin",
      "className": "Penguin",
      "position": {
        "x": 638.1312702970075,
        "y": 479.97866287070036
      },
      "properties": {
        "renderOrder": 5,
        "state": "idle",
        "x": 638.1312702970075,
        "y": 479.97866287070036,
        "vx": 0,
        "vy": 0,
        "radius": 16,
        "mass": 1,
        "launched": false,
        "maxTrailLength": 20,
        "currentAnimationType": "xc",
        "isSpinning": false,
        "initialized": true,
        "aniFrame": 0,
        "aniDir": 1,
        "aniMax": 11,
        "aniMin": 0,
        "aniSwap": 1,
        "crashedTimer": 0,
        "crashedDuration": 2,
        "crashedFrameCount": 0,
        "realSpritesLoaded": true
      }
    },
    {
      "type": "slingshot",
      "className": "Slingshot",
      "position": {
        "x": 637,
        "y": 450
      },
      "properties": {
        "rotation": 0,
        "alpha": 1,
        "visible": true,
        "width": 100,
        "height": 100,
        "renderOrder": 3,
        "velocityMultiplier": 15,
        "maxPullback": 100,
        "minPullback": 10,
        "isPulling": false,
        "rubberBandColor": "#FFFF00",
        "hoopColor": "#00FFFF",
        "glowColor": "#0099FF",
        "hoopRadiusX": 16,
        "hoopRadiusY": 29
      }
    },
    {
      "type": "target",
      "className": "Target",
      "position": {
        "x": 73,
        "y": 97
      },
      "properties": {
        "rotation": 0,
        "alpha": 1,
        "visible": true,
        "width": 60,
        "height": 60,
        "renderOrder": 4,
        "spriteType": "ship_open",
        "shipState": "open",
        "hitFrameCount": 0,
        "hitDuration": 30,
        "isHit": false
      }
    },
    {
      "type": "textobject",
      "className": "TextObject",
      "position": {
        "x": 661,
        "y": 259
      },
      "properties": {
        "rotation": 0,
        "alpha": 1,
        "visible": true,
        "width": 103.609375,
        "height": 231.2,
        "renderOrder": 8,
        "content": "Click on Kevin and hold your mouse down. Then pull Kevin back to the tip of the arrow and let your mouse go.",
        "fontSize": 16,
        "color": "#FFFFCC",
        "fontFamily": "Arial, sans-serif",
        "textAlign": "left",
        "backgroundColor": "rgba(0, 0, 0, 0.7)",
        "padding": 10,
        "autoSize": true,
        "borderRadius": 8,
        "maxWidth": 83.609375,
        "fadeIn": false,
        "fadeInDuration": 1,
        "fadeTimer": 0
      }
    },
    {
      "type": "pointingarrow",
      "className": "PointingArrow",
      "position": {
        "x": 67,
        "y": 130
      },
      "properties": {
        "rotation": -90,
        "alpha": 0.774742714222187,
        "visible": true,
        "width": 36,
        "height": 20,
        "renderOrder": 9,
        "color": "#00FFFF",
        "glowColor": "#0099FF",
        "baseWidth": 20,
        "scaleWithDistance": true,
        "minWidth": 15,
        "maxWidth": 60,
        "pulseSpeed": 3,
        "pointingAt": {
          "x": 67,
          "y": -10
        },
        "maxDistance": 300,
        "pulseTimer": 10.429767333333293,
        "minAlpha": 0.6,
        "maxAlpha": 1
      }
    },
    {
      "type": "pointingarrow",
      "className": "PointingArrow",
      "position": {
        "x": 705,
        "y": 481
      },
      "properties": {
        "rotation": 90.09630545318595,
        "alpha": 0.774742714222187,
        "visible": true,
        "width": 60,
        "height": 20,
        "renderOrder": 9,
        "color": "#00FFFF",
        "glowColor": "#0099FF",
        "baseWidth": 20,
        "scaleWithDistance": true,
        "minWidth": 15,
        "maxWidth": 60,
        "pulseSpeed": 3,
        "pointingAt": {
          "x": 689,
          "y": 10000
        },
        "maxDistance": 300,
        "pulseTimer": 10.429767333333293,
        "minAlpha": 0.6,
        "maxAlpha": 1
      }
    },
    {
      "type": "textobject",
      "className": "TextObject",
      "position": {
        "x": 118,
        "y": 194
      },
      "properties": {
        "rotation": 0,
        "alpha": 1,
        "visible": true,
        "width": 187.484375,
        "height": 58.4,
        "renderOrder": 8,
        "content": "Try to get Kevin back to the ship!",
        "fontSize": 16,
        "color": "#FFFFCC",
        "fontFamily": "Arial, sans-serif",
        "textAlign": "left",
        "backgroundColor": "rgba(0, 0, 0, 0.7)",
        "padding": 10,
        "autoSize": true,
        "borderRadius": 8,
        "maxWidth": 167.484375,
        "fadeIn": false,
        "fadeInDuration": 1,
        "fadeTimer": 0
      }
    }
  ],
  "rules": {
    "maxTries": null,
    "timeLimit": null,
    "scoreMultiplier": 1,
    "requiredBonuses": null,
    "allowedMisses": null,
    "gravitationalConstant": 3
  }
}