{
  "name": "Custom Level 3",
  "description": "Generated by Level Editor",
  "startPosition": {
    "x": 675.3245270169945,
    "y": 491.7804803385644
  },
  "targetPosition": {
    "x": 100,
    "y": 53
  },
  "objects": [
    {
      "type": "penguin",
      "className": "Penguin",
      "position": {
        "x": 675.3245270169945,
        "y": 491.7804803385644
      },
      "properties": {
        "renderOrder": 5,
        "state": "idle",
        "x": 675.3245270169945,
        "y": 491.7804803385644,
        "vx": 0,
        "vy": 0,
        "radius": 16,
        "mass": 1,
        "launched": false,
        "maxTrailLength": 20,
        "currentAnimationType": "xc",
        "isSpinning": false,
        "initialized": true,
        "aniFrame": 0,
        "aniDir": 1,
        "aniMax": 11,
        "aniMin": 0,
        "aniSwap": 1,
        "crashedTimer": 0,
        "crashedDuration": 2,
        "crashedFrameCount": 0,
        "realSpritesLoaded": true
      }
    },
    {
      "type": "slingshot",
      "className": "Slingshot",
      "position": {
        "x": 664,
        "y": 464
      },
      "properties": {
        "rotation": 67.82206288139085,
        "alpha": 1,
        "visible": true,
        "width": 100,
        "height": 100,
        "renderOrder": 3,
        "velocityMultiplier": 10,
        "maxPullback": 100,
        "minPullback": 10,
        "isPulling": false,
        "rubberBandColor": "#FFFF00",
        "hoopColor": "#00FFFF",
        "glowColor": "#0099FF",
        "hoopRadiusX": 16,
        "hoopRadiusY": 29
      }
    },
    {
      "type": "target",
      "className": "Target",
      "position": {
        "x": 100,
        "y": 53
      },
      "properties": {
        "rotation": 0,
        "alpha": 1,
        "visible": true,
        "width": 60,
        "height": 60,
        "renderOrder": 4,
        "spriteType": "ship_open",
        "shipState": "open",
        "hitFrameCount": 0,
        "hitDuration": 30,
        "isHit": false
      }
    },
    {
      "type": "planet",
      "className": "Planet",
      "position": {
        "x": 126,
        "y": 483
      },
      "properties": {
        "rotation": 0,
        "alpha": 1,
        "visible": true,
        "width": 194,
        "height": 194,
        "renderOrder": 2,
        "radius": 97,
        "mass": 500,
        "collisionRadius": 105,
        "gravitationalReach": 5000,
        "color": "#FFFF00",
        "planetType": "planet_saturn",
        "orbit": {
          "orbitCenter": {
            "x": 0,
            "y": 0
          },
          "orbitRadius": 0,
          "orbitSpeed": 0,
          "orbitAngle": 0,
          "orbitType": "circular",
          "orbitParams": {}
        }
      }
    },
    {
      "type": "bonus",
      "className": "Bonus",
      "position": {
        "x": 433,
        "y": 183
      },
      "properties": {
        "rotation": 46.644989333333776,
        "alpha": 0.8474156014026859,
        "visible": true,
        "width": 42.5,
        "height": 43,
        "renderOrder": 1,
        "value": 3000,
        "rotationSpeed": 3,
        "state": "notHit",
        "collectedRotationSpeed": 30,
        "collected": false,
        "pulseTimer": 2.393570000000425,
        "pulseSpeed": 0.1,
        "orbit": {
          "orbitCenter": {
            "x": 0,
            "y": 0
          },
          "orbitRadius": 0,
          "orbitSpeed": 0,
          "orbitAngle": 0,
          "orbitType": "circular",
          "orbitParams": {}
        }
      }
    },
    {
      "type": "textobject",
      "className": "TextObject",
      "position": {
        "x": 363,
        "y": 548
      },
      "properties": {
        "rotation": 0,
        "alpha": 1,
        "visible": true,
        "width": 158.53125,
        "height": 58.4,
        "renderOrder": 8,
        "content": "Planets will \"pull\" at Kevin.",
        "fontSize": 16,
        "color": "#ffffff",
        "fontFamily": "Arial, sans-serif",
        "textAlign": "left",
        "backgroundColor": "rgba(0, 0, 0, 0.7)",
        "padding": 10,
        "autoSize": true,
        "borderRadius": 8,
        "maxWidth": 138.53125,
        "fadeIn": false,
        "fadeInDuration": 1,
        "fadeTimer": 0
      }
    },
    {
      "type": "pointingarrow",
      "className": "PointingArrow",
      "position": {
        "x": 230,
        "y": 540
      },
      "properties": {
        "rotation": 189.86580694308438,
        "alpha": 0.956357167160879,
        "visible": true,
        "width": 50.01785258978626,
        "height": 20,
        "renderOrder": 9,
        "color": "#00FFFF",
        "glowColor": "#0099FF",
        "baseWidth": 20,
        "scaleWithDistance": true,
        "minWidth": 15,
        "maxWidth": 60,
        "pulseSpeed": 3,
        "pointingAt": {
          "x": 0,
          "y": 500
        },
        "maxDistance": 300,
        "pulseTimer": 2.393570000000425,
        "minAlpha": 0.6,
        "maxAlpha": 1
      }
    }
  ],
  "rules": {
    "maxTries": null,
    "timeLimit": null,
    "scoreMultiplier": 1.5,
    "requiredBonuses": null,
    "allowedMisses": null,
    "gravitationalConstant": 3.5999999999999996
  }
}