{
  "name": "Custom Level 6",
  "description": "Generated by Level Editor",
  "startPosition": {
    "x": 123.50519601945913,
    "y": 101.54628216548264
  },
  "targetPosition": {
    "x": 700,
    "y": 300
  },
  "objects": [
    {
      "type": "slingshot",
      "className": "Slingshot",
      "position": {
        "x": 123.50519601945913,
        "y": 101.54628216548264
      },
      "properties": {
        "name": "Slingshot 1",
        "rotation": 0,
        "alpha": 1,
        "visible": true,
        "width": 100,
        "height": 100,
        "renderOrder": 3,
        "velocityMultiplier": 8,
        "maxPullback": 100,
        "minPullback": 10,
        "isPulling": false,
        "rubberBandColor": "#FFFF00",
        "hoopColor": "#00FFFF",
        "glowColor": "#0099FF",
        "hoopRadiusX": 16,
        "hoopRadiusY": 29
      }
    },
    {
      "type": "target",
      "className": "Target",
      "position": {
        "x": 700,
        "y": 300
      },
      "properties": {
        "name": "Target 1",
        "rotation": 0,
        "alpha": 1,
        "visible": true,
        "width": 60,
        "height": 60,
        "renderOrder": 4,
        "spriteType": "ship_open",
        "shipState": "open",
        "hitFrameCount": 0,
        "hitDuration": 30,
        "isHit": false
      }
    },
    {
      "type": "planet",
      "className": "Planet",
      "position": {
        "x": 386.9176509485267,
        "y": 356.807425621683
      },
      "properties": {
        "name": "Planet 1",
        "rotation": 0,
        "alpha": 1,
        "visible": true,
        "width": 60,
        "height": 60,
        "renderOrder": 2,
        "radius": 30,
        "mass": 800,
        "collisionRadius": 38,
        "gravitationalReach": 5000,
        "color": "#C8C8C8",
        "planetType": "planet_pink",
        "id": "planet_1",
        "orbit": {
          "orbitCenter": null,
          "orbitTargetId": null,
          "orbitRadius": 0,
          "orbitSpeed": 0,
          "orbitAngle": 0,
          "orbitType": "circular",
          "orbitParams": {}
        }
      }
    },
    {
      "type": "bonus",
      "className": "Bonus",
      "position": {
        "x": 362.02274032220447,
        "y": 428.61441292032566
      },
      "properties": {
        "name": "Big Chungo1",
        "rotation": 134.01680799999838,
        "alpha": 0.605980398660385,
        "visible": true,
        "width": 42.5,
        "height": 43,
        "renderOrder": 1,
        "value": 258,
        "rotationSpeed": 3,
        "state": "notHit",
        "collectedRotationSpeed": 30,
        "id": "bonus_2",
        "collected": false,
        "pulseTimer": 44.67226933333437,
        "pulseSpeed": 0.1,
        "orbit": {
          "orbitCenter": null,
          "orbitTargetId": "planet_1",
          "orbitRadius": 76,
          "orbitSpeed": 3,
          "orbitAngle": 278.36467466666113,
          "orbitType": "circular",
          "orbitParams": {
            "size": 76
          }
        }
      }
    },
    {
      "type": "bonus",
      "className": "Bonus",
      "position": {
        "x": 347.4437915118765,
        "y": 282.6601773843035
      },
      "properties": {
        "name": "Big Chungo2",
        "rotation": 134.01680799999838,
        "alpha": 0.605980398660385,
        "visible": true,
        "width": 42.5,
        "height": 43,
        "renderOrder": 1,
        "value": 258,
        "rotationSpeed": 3,
        "state": "notHit",
        "collectedRotationSpeed": 30,
        "id": "bonus_3",
        "collected": false,
        "pulseTimer": 44.67226933333437,
        "pulseSpeed": 0.1,
        "orbit": {
          "orbitCenter": null,
          "orbitTargetId": "planet_1",
          "orbitRadius": 84,
          "orbitSpeed": 3,
          "orbitAngle": 249.26740799999578,
          "orbitType": "circular",
          "orbitParams": {}
        }
      }
    },
    {
      "type": "bonus",
      "className": "Bonus",
      "position": {
        "x": 258.27206250634856,
        "y": 304.164167987246
      },
      "properties": {
        "name": "Big Chungo3",
        "rotation": 134.01680799999838,
        "alpha": 0.605980398660385,
        "visible": true,
        "width": 42.5,
        "height": 43,
        "renderOrder": 1,
        "value": 258,
        "rotationSpeed": 3,
        "state": "notHit",
        "collectedRotationSpeed": 30,
        "id": "bonus_4",
        "collected": false,
        "pulseTimer": 44.67226933333437,
        "pulseSpeed": 0.1,
        "orbit": {
          "orbitCenter": null,
          "orbitTargetId": "planet_1",
          "orbitRadius": 139,
          "orbitSpeed": 1,
          "orbitAngle": 9.81319999999997,
          "orbitType": "circular",
          "orbitParams": {}
        }
      }
    },
    {
      "type": "bonus",
      "className": "Bonus",
      "position": {
        "x": 215.72475375589394,
        "y": 463.34290345531633
      },
      "properties": {
        "name": "Big Chungo4",
        "rotation": 134.01680799999838,
        "alpha": 0.605980398660385,
        "visible": true,
        "width": 42.5,
        "height": 43,
        "renderOrder": 1,
        "value": 258,
        "rotationSpeed": 3,
        "state": "notHit",
        "collectedRotationSpeed": 30,
        "id": "bonus_5",
        "collected": false,
        "pulseTimer": 44.67226933333437,
        "pulseSpeed": 0.1,
        "orbit": {
          "orbitCenter": {
            "x": 384,
            "y": 359
          },
          "orbitTargetId": null,
          "orbitRadius": 198,
          "orbitSpeed": 1,
          "orbitAngle": 404.71040400001607,
          "orbitType": "circular",
          "orbitParams": {}
        }
      }
    },
    {
      "type": "bonus",
      "className": "Bonus",
      "position": {
        "x": 460.59727652903166,
        "y": 402.0390877558025
      },
      "properties": {
        "name": "Big Chungo5",
        "rotation": 134.01680799999838,
        "alpha": 0.605980398660385,
        "visible": true,
        "width": 42.5,
        "height": 43,
        "renderOrder": 1,
        "value": 258,
        "rotationSpeed": 3,
        "state": "notHit",
        "collectedRotationSpeed": 30,
        "id": "bonus_6",
        "collected": false,
        "pulseTimer": 44.67226933333437,
        "pulseSpeed": 0.1,
        "orbit": {
          "orbitCenter": null,
          "orbitTargetId": "planet_1",
          "orbitRadius": 98,
          "orbitSpeed": 1,
          "orbitAngle": 25.852700000000095,
          "orbitType": "elliptical",
          "orbitParams": {}
        }
      }
    }
  ],
  "rules": {
    "maxTries": null,
    "timeLimit": null,
    "scoreMultiplier": 1.5,
    "requiredBonuses": null,
    "allowedMisses": null,
    "gravitationalConstant": 3
  }
}
